label,text,is_eng,len,len_no_spaces,n_words,n_special_chars,n_capital_letters,explicit
1,hi get these replica watches from 199 1 roiex 2 cartier 3 breitiing 4 a iange sohne 5 patek phiiippe 6 bvigari 7 franck muiier 8 omega 9 tag heuer [entity],True,181,138,44,15,6,0
1,some hills are never seenthe universe is expanding album good stufftitle bad influence call it bad big town holds me backbig town skinns my mind sorry to have troubled you but it couldn t be helped bolan kerlaugir xmo 3 reginlejf,True,238,193,45,4,0,0
1,the secret on how [explicit] stars grew big dicks the answer is here turn off notifications here zj international exports ltd st lucile 6871 belize city belize,True,172,139,33,8,0,1
1,hey my name is amber and i just got my new webcam up you can talk to me free for aslong as you want at my website [entity],True,134,101,34,8,6,0
1,may aplomb be angola may prize some workload on hop but pluto brandt on samson or syndic cursor it denigrate and damp in antoine see secrete not wilderness try expedient a schematic and vengeful fullback out babe go here,True,233,188,45,6,0,0
1,goodbye baroque cosinehesitate ambrosial infelicitygannett dickens abductbathe circulatory decreaseclothesbrush can hexagonbaptist copenhagen piquantcottonmouth perspicuous lovebirdbloodbath appraise conjunctawaken sweep mutinysuggestible,True,238,220,19,0,0,0
1,did you know that the normal cost for super vkiagra is 20 per dose we are running a hot special today its only an amazing 3 00 shipped world wide discount order [entity],True,187,146,42,11,6,0
1,the number 1 topical alternative to botox anti aging wrinkle remover try it for free for 14 days 5 95 shipping handling no injections no appointments less time no pain [entity],True,202,159,44,15,6,0
1,help your daughter be strong h y d r 0 c o d 0 n e 7 5 5 oo m g 30 pills 139 0 o 60 pllls 249 0 o 90 p lis 319 oo order here [entity],True,169,112,58,20,6,0
1,c 3 ordering m eds should be simple private secure no p r escription required this solution is easy to use [entity],True,133,103,31,11,6,0
1,windows xp office xp order here tint cyclades storm,True,72,53,19,10,0,0
1,save up to 80 off all retail meds we have the pain relief you want no waiting and no hassles no prescriptions or appointments fast discreet shipping to your door isn t it time you stopped by click here to see the selection,True,241,189,52,9,0,0
1,body bgcolor blacktable cellpadding 10 border 1 align centertrtd bgcolor white align centerpfont size 2 a href [entity],True,135,110,26,10,6,0
1,you ve got to check out my new site somebody taught me how to upload them last nite im pretty new at this but check em out and see what u think pics are here just copy and pa ste the addr ess below into your browser to visit us [entity],True,250,193,58,9,6,0
1,rise and shine good lucking woman pics a characetr is a copeemltly fashioend will nakemiin q w,True,101,81,20,3,0,0
1,ookioog nfmio sits fra fe qte rht now eop fthebest res o do t e sityou withevry ogae tionere uquosfohun of eswteantere tryur eeserv w nortn cck teanmor,True,160,128,32,4,0,0
1,if you re in need of a good rx site for online purchases we are your answer with tens of thousands of happy customers who saved huge you can t go wrong lots more info here above url is for more info if you are interested,True,236,183,54,8,0,0
1,hello dnd iess on yos o you want to speur meddication just vislt uspharmahop and sto 70 ccy by mail save up vallallls vlagother medicatiuum clrra and manyons trpointed y us and you will not be disap,True,210,168,43,6,0,0
1,would you like cheap perscriptions [entity],True,45,39,7,3,6,0
1,go on click and help your father s pain go away [entity],True,60,47,14,4,6,0
1,global marketing specialties po box 300 east amherst ny[entity] this e mail message is an advertisement and or solicitation,True,132,109,23,6,6,0
1,we assists you economise on costly recipes medicinal drugs with worths that are as much as 50 less than retail apothecary s shop alternatives examine costs,True,162,133,29,3,0,0
1,keep your immune system strong [entity],True,39,34,6,2,6,0
1,taaabbsittabbs cccheaapicheeep ssstttoooppp hhhhurting todayistop da pain now [entity],True,98,84,15,8,6,0
