label,text,is_eng,len,len_no_spaces,n_words,n_special_chars,n_capital_letters,explicit
1,iu b 2 iro[entity] cable tv viewers [entity],True,50,40,11,7,12,0
1,call me at rolex time amy acuff loves rolex watches,True,52,42,10,0,0,0
1,save up to 80 on popular meds great specials check it out k[entity],True,85,64,22,11,6,0
1,do you swing well these couples do find in your area don t go to far cheating wives we have them with updated profiles [entity],True,153,116,38,15,6,0
1,hello [entity] h a rd p 0 r n m o v i e s 15 gb regular updates included p a r i s h ilt o n getting f cked [entity],True,174,113,62,33,12,0
1,mediccationns at lowesst pricess everyy over 80 offf pricess wontt get lowerr we selll vic od in v ia gra x ana x [entity],True,142,109,34,12,6,0
1,triplett 75 off for all new softwares windowxp professional 50 window office professional 2003 60 photoshop 7 0 60 and more and more good products why buy in retailprices district at almost every,True,226,178,48,15,0,0
1,looking for vlcodln only place you can get it without prescription glad 4 myrx now with same day shipping we are unbeatable under priced deals on other products like vallum too deals wont last visit us now,True,224,178,46,9,0,0
1,ever been jealous of the monster [explicit] [explicit] stars learn their secrets right here turn off notifications here pb international exports ltd st brenton 9919 belize city belize,True,196,162,34,10,0,2
1,curse defined by chain saw for pocket and beyond ocean are what made america great [ 3,True,92,73,20,4,0,0
1,put an end to unwanted spam popups and other internet security hazards permanently more info here,True,106,86,20,4,0,0
1,hello it s me lauren husband on business trip my profile is online you can come and chat with me if you want to get to know each other better we can have a date ztop it [entity],True,197,150,48,12,6,0
1,we have all your health products breakthrough in medical science has enabled a team of 14 specialized doctors to create a pill designed specifically for p e n i s enlargement just look [entity],True,199,163,37,5,6,0
1,sa ve 7 0 ord ering onl ine to day vi sit our site and sa ve big removemeplease,True,98,70,28,9,0,0
1,do you want cheap and new overseas drugs [entity],True,51,42,10,3,6,0
1,if you are paying more than 3 10 on your mortgage we can slash your payment approval regardless of credit history start saving today please fill out the form to receive free quotes on refinancing your home mortgage [entity],True,235,191,45,8,6,0
1,your place to ggo too for all ur prreeiscrlpt 10 n pi s no doxxtctorr neeedeed paaiixnnninxxn kiiiiilllerxxs [entity],True,125,103,23,6,6,0
1,tue 11 jan[entity] 14 [entity] sir we have had trouble getting a hold of you by phone as we promised your morttgage app was apprroved with 3 9 please correct your info here so we can start [entity],True,214,169,46,15,18,0
1,yael hastala vista barbra provided herself the miss elliot at home were laid on the table but not a bit did walter stir with a courteous comprehensive smile to all and one smile and,True,196,155,41,7,0,0
1,holiday specials on didrex and nasacort 60 other great products help with heartburn relief pain relief and more overnight fedex shipping gets your meds to you promptly [entity],True,184,153,32,6,6,0
1,paint shop small world could i speak to in 1869 i ll call back surfing,True,82,62,21,6,0,0
1,deport wild latina girls image loading backwater remove me please if you would like to be removed from our mailing lists please click here actinolite gmuj bqj wxnluvx ynvk ax socdeo kddaainebfqdzujentqhk hypothalamus skbweph,True,234,196,39,5,0,0
1,for more details see the attachment attachment no virus found bitdefender antivirus [entity],True,110,89,22,11,6,0
1,our offer windows xp pro office xp professional 80 [entity],True,69,55,15,7,6,0
1,haven t we met somewhere before isolation is the sum total of wretchedness to a man love is like pi natural irrational and very important paliourg highquality medication for you shipping worldwide [entity],True,235,188,48,17,6,0
1,relax at e store and select super benefits and great value check our store for all these exciting ddeals cut down the expenditures on medis [entity],True,156,127,30,6,6,0
1,medicafont style font size lpxcm fonttifont style font size lpxl fonton for less shop stop [entity],True,117,93,25,11,6,0
1,we crdec 9 gee san hoebing which one do you n e ed badly for pain relief claritine for allergy or retin a for anti aging we cover them all ke npd [entity],True,174,132,43,12,6,0
1,sparks online doctors up to 70 of the best pain killers out som vioxx v ia gra fioriceet phentremine and other popular meds valium xan x i lis [entity],True,197,146,52,25,6,0
1,wakey wakey to say the truth reason and love keep little company together now a days culture is the widening of the mind and of the spirit paliourg interested in saving up to 70 on medications [entity],True,219,174,46,11,6,0
1,high quality handbags swiss made watches sprot shoes sterling silver jewelry northface jacket and much more at [entity],True,129,107,23,7,6,0
1,hook up with a lonely desperate housewife bored wives need some no strings luvvin they are easy they re fun and they need a good roll in the hay get a date with a housewife tonight nomore here [entity],True,205,165,41,4,6,0
1,mediccationns at lowesst pricess everyy over 80 offf pricess wontt get lowerr we selll vic od in v ia gra x ana x [entity],True,142,109,34,12,6,0
1,to unsubscribe from this mailing list click here or send a blank message to r superdeals 0 30 fel 4 f 1314 iit demokritos gr [entity] com optinrealbig com llc 1333 w 120 th ave suite 101 westminster colorado[entity],True,246,192,54,19,12,0
1,home [explicit] [entity],True,46,33,14,15,6,1
1,fuller harder erectionsstarts working within just 15 minuteslonger effects minimal side effects clalls select the manufacturer you trust easy to buy delivery and shipping worldwide to change your mail preferences,True,216,185,32,2,0,0
1,off shorejph armacy dishnow 4 openhto 3 thespublich when we say open to the public we mean open,True,108,84,24,6,0,0
1,hi pearl have yoooou ever had a prooooblem geeeeeetting it up driiink too much toniiiiiight i ve gooooooot the cureeee sincerely benny burris nooooo moooreeee meeessaageees heeeeereee [entity],True,204,171,34,8,6,0
1,true replications wrist watches our company have next trademarks available too carrier vacheron constantin glashute original zenith tag heuer,True,144,124,20,1,0,0
1,87 00 high speed [entity] g 4 port wireless router 54 mbps [entity] g 4 port wireless routerdi 524 airplus g[entity] g wireless router visit [entity],True,167,134,34,18,24,0
1,today special offfers vieagra 109 up vicodiin 97 up cialiis 99 up viooxx 46 up valiium 119 up and lotss moreee [entity],True,163,120,44,24,6,0
1,b uy meds for 8 o less than in regular store 100 trusted site from canada or der h ere [entity],True,105,80,26,7,6,0
1,simply rx online pharmacy high demanded medications at affordable prices order online now,True,101,83,19,6,0,0
1,please refer all questions opinions or additional feedback to service dept 9420 reseda blvd 133 northridge ca[entity],True,126,105,21,6,6,0
1,what about their health v i 0 x x 25 m g 3 o piils 72 5 o v 1 a g r a loo m g 32 pills 149 oo c 1 a l 1 s 2 o m g lo pills 79 oo create an 0 r d e r [entity],True,207,130,78,27,6,0
1,hello there sode,True,19,15,4,1,0,0
1,61 bb hey derm bbbbb check out paris and many other celebs at bl 1,True,69,53,16,1,0,0
1,the secret on how [explicit] stars grew big dicks the answer is here turn off notifications here lc international exports ltd st eugenio 4999 belize city belize,True,173,140,33,8,0,1
1,t o d a y s s p e c i a l visit http [entity],True,53,34,20,6,6,0
1,find partners for hot pictures of lonely couplez,True,49,41,8,0,0,0
1,a permanent fix to [explicit] enlargement limited offer add atleast 4 inches or get your money back visit us and see more no more offers,True,147,117,30,7,0,1
1,script language javascript type text javascript function dopopunder var a [entity],True,104,83,22,13,6,0
1,bodytable border 0 align centertrtd border 1 table border 1 trtda href [entity],True,89,72,18,7,6,0
1,the best financial how to on the internet need to make money fast you must see this site [entity],True,103,82,22,5,6,0
1,save up to 80 on popular meds great specials check it out k[entity],True,85,64,22,11,6,0
1,save 70 shipped worldwide zocor [explicit] cialis 1 89 0 78 3 00 soma lipitor levitra 1 22 1 89 1 00 meridia ultram soma 1 11 1 11 1 22 see our full offer no more,True,201,145,56,21,0,1
1,isaac 75 off for all new softwares windowxp photoshop window 2003 etcmore gregarious she was gently,True,122,95,27,11,0,0
1,paliourg new super [explicit] regalis at huge discounts most charge 18 we charge 5 save 80 regalis is newer and better because lasts all weekend less sideeffects higher success rate shipped world wide [entity],True,231,187,45,15,6,1
1,please click the below if you do not want to hear about any more of our great offers [entity],True,95,76,20,3,6,0
1,not interested,True,17,14,3,1,0,0
1,rnd alt rnd alt rnd alt over 160 meds to choose from with no prescription required never mind rnd alt rnd alt rnd alt,True,144,107,37,13,0,0
1,see the htm attachment for online purchases and special offers thank you,True,77,63,14,2,0,0
1,please wait for above image to load don t overpay for the same results limited time only we ll double your order for free click here for more details,True,165,129,37,8,0,0
1,watch my pa n tolerancy v c o p r o f e n 7 5 2 oo m gg 3 o pills[entity] o pills[entity] pllis 339 oo contact [entity],True,151,106,46,22,18,0
1,2005 cable t v de 5 rambler with f r e e lock out buster early bird offer great gift for you and others for the holidays 39 95 gives you all your free events movies perfect offer [entity],True,205,158,48,11,6,0
1,do you want a inexpensive drugs [entity],True,42,35,8,3,6,0
1,katya getting down and dirty playing with her favorite toy a huge [explicit] all inside remove your email,True,111,91,21,5,0,1
1,paliourg valiumxanaxcialis and more get hydrocodone or soma 2 of the best pain killers out please lqqk [entity],True,127,102,26,10,6,0
1,our tablets is an innovative fat banding appendix that removes grease from the food you sup developed with the potent grease binding fibre the mixture of biological multipliers test it,True,199,162,37,7,0,0
1,would you want cheap perscriptions [entity],True,45,39,7,3,6,0
1,hey glide it on feel it get harrd then slide it in trust me she ll love you even more talk to you bart,True,131,93,38,14,0,0
1,htmlheadtitlelt lt subscription [entity] gr gt gt title head body marginheight 0 bgcolor 615 e 5 b topmargin 0 link ae 2601 vlink ae 2601 alink ae 2601 a href [entity],True,203,155,49,22,12,0
1,the only fix to [explicit] growth limited time offer increase atleast 4 inches or your money back visit us to see more no more offers,True,144,114,30,7,0,1
1,eshopkey [entity],True,22,19,4,5,6,0
1,a new day has dawned there is a better way introducing the new handheldmed website [entity],True,97,79,19,5,6,0
1,finally a place for the sexually liberated find the love and romance you deserve [entity],True,93,77,17,4,6,0
1,would you want inexpensive perscriptions [entity],True,51,45,7,3,6,0
1,from guts to glory become eight inc hes in lenght [entity],True,60,49,12,3,6,0
1,hi get these replica watches from 199 1 roiex 2 cartier 3 breitiing 4 a iange sohne 5 patek phiiippe 6 bvigari 7 franck muiier 8 omega 9 tag heuer [entity],True,181,138,44,15,6,0
1,shocking child [explicit] pics and movies [entity],True,50,44,7,4,6,1
1,indulge yourself buy a tag heuer watch all watches arrive in a luxury gift box the perfect gift we have in stock watches like breguet bmw dior please 0 r d e r here [entity],True,191,148,44,11,6,0
1,enlarge your penls nowcllck h 3 re no more,True,44,35,10,1,0,0
1,r 3 move market research 8721 santa monica boulevard 1105 los angeles ca[entity],True,84,70,15,4,6,0
1,we are offering 100 free lifetime memberships to our reality [explicit] this is for advertising and marketing purposes take away,True,133,111,22,4,0,1
1,mortgage finder can help you find the right lender you also can have you self taken off our group,True,106,83,23,4,0,0
1,would you want cheap pain killers [entity],True,44,37,8,3,6,0
1,numbers 75 off for all new softwares windowxp photoshop window 2003 etcmore concretion the barman took,True,125,98,27,11,0,0
1,the lowest price of all med s is here xa nax 154 only via gra 57 only vaiium 154 only cia is 135 only tramadol 99 only we are the be st available nowadays ree movee below [entity],True,235,170,66,30,6,0
1,rnd alt rnd alt rnd alt fast ups shipping on low price drugs from canada take off 6 rnd alt rnd alt rnd alt,True,134,97,37,13,0,0
1,friday january 23 2004 miningnews net to allow you to read the stories below we have arranged a complimentary one month subscription for you to accept click here to visit our extended service at [entity],True,215,175,41,8,6,0
1,unsubscribe isocline frozen ambivalentcoriolanus amicable ascriptionarcher octet tristanterm mother drovetruly solder galvanicdubitable tilde leakagecollectible etc inventorairtight terrain cranenotebook,True,203,186,18,0,0,0
1,you can download full length adult dvds from the comfort of your own home and keep them forever we re now offering one week free see it here nah i dont want it,True,174,134,40,7,0,0
1,a permanent solution to [explicit] growth limited time offer add atleast 3 inches or get your money back visit us and see more no more offers,True,154,122,32,8,0,1
1,your place to ggo too for all ur prreexxxxiscrlpt 10 n pi sx paaaaain killerzxss noeoo presscippt [entity],True,112,92,21,5,6,0
1,do not leave them hanging tonight generic [explicit] get it now rock there world click here to be removed,True,120,94,26,9,0,1
1,table align center width 100 trtd align centertable border 1 cellpadding 4 trtd colspan 2 align center bgcolor coc 0 fffont face arialba href [entity],True,174,138,37,14,6,0
1,correa 75 off for all new softwares windowxp professional 50 window office professional 2003 60 photoshop 7 0 60 and more and more good products why buy in retailprices accolade twisted to begin,True,225,177,48,15,0,0
1,generic [explicit] at 1 63 no prescription required 100 safe and secure doctor approved works in less then 15 min free shipping order now,True,145,118,28,6,0,1
1,morning woodson are you sick of taking pil 1 s have you been looking for that extra umphh in the bed room if so then we ve got the answer for you it s kindof like k y but a hundred times better [entity],True,220,168,53,11,6,0
1,you gotta check out h g hormone dietary therapy forget dieting forever achieve many benefits including memory 62 improvement body fat loss 82 improvement increase energy do this all with no strenuous exercise no dieting [entity],True,244,201,44,10,6,0
1,hi did you recieve my email from last week i m happy to tell you that you are approved for a home loan with a 2 71 rate your tracking number is wi 224 you must visit the link below in 24 hrs to confirm your details [entity],True,239,184,56,10,6,0
1,unbelievably cheap pain relief pil 1 s v 1 c o d 1 n 75 o m gg 3 o pills 169 0 o 6 o pllls[entity] p s 319 0 o full list [entity],True,155,108,48,17,12,0
1,hey there loalis the weill wve it for lery i m nterestanks again journey tqiv dxbli xlhs fdtjji omxrahqwjpbtcsq w sp,True,132,104,29,8,0,0
1,d 840 vz 94 cartier piaget expensive look not expensive price omega logines louis vuitton [entity] you don t want to miss this [entity],True,144,117,28,9,12,0
1,zenoil is a brand new topical lubricant designed to immediately increase the power and size of your erections and give you a more intense and satisfying sexual experience more information,True,192,160,32,2,0,0
1,genuine repiica watches over 20 brands including rolex omega iwc more detalls here r emove me,True,104,83,21,5,0,0
1,clearance bundle 1 windows x p pro and office x p pro 8 o dollars you should hurry [entity],True,101,78,24,7,6,0
1,page is loading image not showing see message here bye bye 8 rnd body,True,81,62,20,6,0,0
1,hello vlsit our medsbymail shop and save over 80 vl raam enle racl is and ag bi vlt al manyother you will be pieasantly surprised with our prlces have a nice day,True,173,136,38,6,0,0
1,huge meds to choose at great discounts save uup to 8 o on all major brands of meds qualitty assured or moneyy bacck guarranteedd this is 1 time mailing no re moval are re qui red,True,203,155,48,12,0,0
1,enlarge your member zenextend enlargement pills we offer the best male augmentation on the web success is guaranteed or receive a full refund check us out and improve your quality of life click here for more info no ineesed click hee,True,236,194,42,1,0,0
1,hi we have a new offer for you buy cheap vagra through our online store private online ordering no prescription required world wide shipping order your drugs offshore and save over 70 click here [entity],True,222,179,44,12,6,0
1,mediccationns at lowesst pricess everyy over 80 offf pricess wontt get lowerr we selll vic od in v ia gra x ana x [entity],True,142,109,34,12,6,0
1,power outlets with surge protection arriving january 2005 visit [entity],True,78,66,13,5,6,0
1,would you like cheap pain killers [entity],True,44,37,8,3,6,0
1,one million profiles of hot old age young age woman that are looking for some part time friendship on the side get to see all of the profiles online today for only one dollar safe age verification bump off,True,214,171,43,4,0,0
1,paliourg heres that info vi gra at 80 discount delivered world wide other sites charge 20 per does we charge 1 66 dlscount vl gra super vi a gra cial is is here,True,193,144,49,16,0,0
1,assist your daughter in pain v 1 c o d 1 n 75 o m gg 30 pilis[entity] o pl s[entity] pills 319 0 o 0 r d e r [entity],True,147,102,46,21,18,0
1,your one stop prescription shop there are more pleasant things to do than beat up people benson you are so free of the ravages of intelligence of those who say nothing few are silent,True,193,154,39,5,0,0
1,poohbear packmatrix jxiac largest selection of on line medications v ico din simple secure and discreet shop the best quii t service is aval iable at we bsite p r [entity],True,197,154,44,15,6,0
1,[entity],True,8,8,1,2,6,0
1,your application has been pre approved on monday november lst 2004 your mrtg process is set for rates starting at 3 25 fixed [entity],True,147,117,31,9,6,0
1,why pay more for valium xanax we deliver to your door overnight no doctor s visits no hassles and no prior prescription required you ll love how convenient our service is visit here [entity],True,204,164,41,9,6,0
1,camacho save 95 for all v iagr a c iali s l evitr a haney i humbly thank,True,101,69,32,14,0,0
1,[ join now take a free tour ] click here to be removed,True,59,44,15,4,0,0
1,d i s c o u n t s on generics [entity],True,42,29,14,4,6,0
1,we just setup an incredible deal for you to put your website promotion on autopilot here s all the details [entity],True,121,98,24,5,6,0
1,feldman online doctors up to 70 of the best pain killers out som vioxx v ia gra fioriceet phentremine and other popular meds valium xan x i lis [entity],True,198,147,52,25,6,0
1,got a condition if you require any of the medications below save up to 80 here [entity],True,95,75,21,6,6,0
1,r 3 mov 3 sll[entity] santa monica blvd 1106 santa monica ca[entity] diat corroteras imizattrys valing shinteraysion paral furill bakize ficknessive rac flicaldeplansgrant [explicit],True,188,161,26,8,12,1
1,meta http equiv content type content text html charset iso [entity] size 2 color 0033 ccloading please wait fontbr ba href [entity],True,170,130,41,24,12,0
1,now loading no more messages,True,34,27,8,3,0,0
1,airpanel vl 50 15 inch [entity] only smart display dock visit http [entity],True,88,70,19,11,12,0
1,the only solution to [explicit] enlargement limited time offer increase atleast 3 inches or get your money back click here and learn more no thanks,True,162,130,32,9,0,1
1,become the 10 inch man your woman craves she wants you to click here turn off notifications here xv international exports ltd st roberto 9330 belize city belize,True,173,139,34,6,0,0
1,save up to 80 on popular meds great specials check it out k[entity],True,85,64,22,11,6,0
1,please wait loading message have you ever seen female [explicit] movies they are 100 authentic no thanks please unsubscribe me,True,157,122,35,17,0,1
1,sheffield 247 online doctorz up to 70 of the best pain killers out and other popular meds valium xxanax cialis [entity],True,147,113,35,16,6,0
1,dmortgage get a zfree qquote stoday wrates as flow as 2 wpay aless just zfill a quickzform do you want to opt 0 ut,True,127,97,30,6,0,0
1,you have the advantage of me ko mao a,True,44,32,12,3,0,0
1,hi we have a new offer for you buy cheap vagra through our online store private online ordering no prescription required world wide shipping order your drugs offshore and save over 70 click here [entity],True,222,179,44,12,6,0
1,html body pbr p p align centera href [entity],True,51,40,12,5,6,0
1,want a inexpensive pain killers [entity],True,42,36,7,3,6,0
1,tuscany selfish avert fitch canto vibrant midshipman compendia adjutant coleman gnomon lay stress patriot print adventurous alva dowager chopin bridge codebreak counterfeit funereal threaten 2,True,192,168,25,0,0,0
1,now online with profiles close to 1 million and counting follow the url by clicking on it and start enjoying today in your area now woman house wives looking to cheat [entity],True,187,150,38,8,6,0
1,los angeles l a observer notes pertaining health c e l e b r e x 2 oo m gg 30 pllis 145 oo 6 o piils[entity] pills 459 oo get t wh le it lasts [entity],True,183,131,53,20,12,0
1,paliourg valiumxanaxcialis and more get hydrocodone or soma 2 of the best pain killers out please lqqk [entity],True,125,101,25,9,6,0
1,you want to free yourself from the debt with us it is easy as 1 2 3 you say what you need we find it for you you can get best deals here,True,145,108,37,4,0,0
1,benthic immaturedirty eclogue conferringbract nightshirt utensilcyrillic schist tananarivevendor basilar manfredexpertise sheet sternumcommodious prowess vhfavuncular elysee lodestonecompulsory momenta imagenrepairmen,True,217,200,18,0,0,0
1,fri 30 apr[entity] 54 [entity] attn digital cable tv customers cable channel filters permits you to get passed cable billing and allow you to watch unlimited cable movies and premium channels get digital cable tv [entity],True,244,198,47,18,18,0
1,[explicit] s newest rival c alis has been around for a while now but it has never been this cheap only 3 99 each now available in softtabs find out more here re move me,True,189,144,45,12,0,1
1,well pushun b shena,True,24,18,6,2,0,0
1,today s special offers visit [entity],True,41,34,8,4,6,0
1,d 452 ch 77 rolex cartier piaget replicas expensive look not expensive price omega longines louis vuitton [entity] a must see [entity],True,153,123,31,14,12,0
1,your place to ggo too for all ur prreeiscrlpt 10 n pi s no doccctctorr neeedeed gget ouut of fuutture addddds by goiiing heree [entity],True,145,116,30,7,6,0
1,youll discover awesome software available at shocking prices your lucky chance to get with discounts dont be deprived of your happiest chance to get this software at most prolific prices ever [entity],True,206,172,35,5,6,0
1,do you want a inexpensive perscriptions [entity],True,50,43,8,3,6,0
1,want a inexpensive pain killers [entity],True,42,36,7,3,6,0
1,today s special v i a g r a retails for 15 we sell for as low as 1 90 private online ordering world wide shipping no prescription required check it out [entity],True,206,151,56,25,6,0
1,the secret on how [explicit] stars grew big dicks the answer is here turn off notifications here wv international exports ltd st nathaniel 4780 belize city belize,True,175,142,33,8,0,1
1,the permanent fix to [explicit] growth limited offer add atleast 4 inches or get your money back visit us to learn more no more offers,True,149,117,32,9,0,1
1,striktuur delibertly cnusc receivd d forsaken ph arm from eur opean 0 vern i ght shippi ng [entity],True,115,90,26,10,6,0
1,your woman needs an 8 inch man be that man for her learn how here turn off notifications here vi international exports ltd st robby 4429 belize city belize,True,170,134,36,7,0,0
1,the only solution to [explicit] enlargement limited time offer add atleast 4 inches or get your money back click here and see more no thanks,True,153,122,31,8,0,1
1,e 2174 x 35 rolex cartier piaget replicas so real you cannot tell the difference omega longines louis vuitton [entity] ya got to see this [entity],True,161,129,33,12,12,0
1,date a m i l f lots of hot mommys who need coock meet married women for only one dollar fee the chat room is rockin [entity],True,136,104,33,8,6,0
1,rnd alt rnd alt rnd alt buy from the best online store rnd alt rnd alt rnd alt,True,105,74,31,13,0,0
1,sup costass here is your online solution for quality medcations at affordable priice shelton i already ordered pil 1 com 2 php dionysian congresswoman canvas,True,170,139,31,6,0,0
1,tuesday january 13 2004 miningnews net to allow you to read the stories below we have arranged a complimentary one month subscription for you to accept click here to visit our extended service at [entity],True,216,176,41,8,6,0
1,don t be like that tororane,True,40,28,12,6,0,0
1,ford motor company reviews do you have a car the new energy and fossil fuel reduction systems up to 60 percent reduction in car costs create an 0 r d e r [entity],True,178,138,41,10,6,0
1,would you like inexpensive perscriptions [entity],True,51,45,7,3,6,0
1,remove larvae adolescent tiftbecloud allison aqueousrichfield pliers assentpentecost avarice acronymbronchitis hadn t quillwortactivation farber futurehubert pang westeidetic livid rebeccapowell,True,196,177,20,1,0,0
1,order your medication here no doctor visit needed safe private and easy i don t like emails,True,104,81,23,6,0,0
